Title,Text,Author,Date,Url
"By the numbers, Basalt High School grads have big plans for the future","<img loading=""lazy"" width=""5279"" height=""683"" src=""https://imengine.public.prod.sci.navigacloud.com/?uuid=faa09a70-e627-5f7f-b652-f0da50c02ab5&amp;type=preview&amp;width=5279&amp;height=3519&amp;q=60"" srcset=""https://imengine.public.prod.sci.navigacloud.com/?uuid=faa09a70-e627-5f7f-b652-f0da50c02ab5&amp;type=preview&amp;width=300&amp;height=200&amp;q=60 300w,https://imengine.public.prod.sci.navigacloud.com/?uuid=faa09a70-e627-5f7f-b652-f0da50c02ab5&amp;type=preview&amp;width=768&amp;height=512&amp;q=60 768w,https://imengine.public.prod.sci.navigacloud.com/?uuid=faa09a70-e627-5f7f-b652-f0da50c02ab5&amp;type=preview&amp;width=1024&amp;height=683&amp;q=60 1024w,https://imengine.public.prod.sci.navigacloud.com/?uuid=faa09a70-e627-5f7f-b652-f0da50c02ab5&amp;type=preview&amp;width=2048&amp;height=1365&amp;q=60 2048w"" alt=""""> <p class=""oc-body"">The Basalt High School’s Class of 2022 seniors have big plans that span at least three continents, more than a dozen states and a full spectrum of post-graduation pursuits, according to data provided by Yerania Moreno, a bilingual communications specialist from the Roaring Fork School District.</p> <p class=""oc-body"">Nearly two thirds of the graduating students will attend either a two-year or four-year institution after graduation, with a couple planning to attend a trade school or vocational program, according to statistics and a spreadsheet of post-grad plans that Moreno provided via email.</p> <p class=""oc-body"">About three dozen among that cohort are staying close to home and heading to institutions like Colorado Mountain College, Western Colorado Community College, Metropolitan State University, Colorado State University and the University of Colorado, Boulder, according to the data.</p> <p class=""oc-body"">(Olympic freestyle skier Hanna Faulhaber, a 2022 Basalt High School grad, will continue to chase top-tier athletic pursuits while attending Colorado Mountain College, according to one of Moreno’s emails.)</p> <p class=""oc-body"">Others are heading to schools in neighboring states at such schools as University of Wyoming and the University of Arizona, and to coastal destinations like Santa Barbara City College in California, Salve Regina University in Newport, Rhode Island, and Loyola University in New Orleans.</p> <p class=""oc-body"">A few are even off to international destinations with plans to attend school in Mexico, New Zealand or Portugal.</p> <p class=""oc-body"">Nearly a quarter of Basalt’s graduates plan to take a gap year, and a dozen students plan to enter the workforce, according to the statistics Moreno provided. Basalt High School’s counseling team wasn’t available for comment before graduation. All told, there are almost 100 graduates this year.</p> <p class=""oc-body"">This year’s valedictorian is Emma Borchers and the salutatorian is Francesca Williams Savi, according to an email from Basalt High School registrar Ann Burns.</p> <p class=""oc-body"">At an academic awards night this spring, the school recognized seven seniors with a lifetime achievement award and departmental cord, according to a May 13 school newsletter. This year’s honorees are Haylie Bledsaw (math), Monet Manning (English), Emma Borchers (science and band), Marlo Bowman (social studies), Zulma Garcia (world languages), Kenia Lipe Zuniga (English language development) and Casey Hocknell (art).</p> <p class=""oc-body""><a href=""https://www.postindependent.com/news/basalt-senior-profile-working-to-bridge-language-barriers/"" target=""_blank"">Borchers</a><svg class=""svg-icon""><use class=""fa-external-link-alt"" xlink:href=""#fa-external-link-alt""></use></svg> and fellow senior <a href=""https://www.postindependent.com/news/basalt-senior-profile-learning-two-languages-to-better-know-her-community/"" target=""_blank"">Madeline Mercatoris</a><svg class=""svg-icon""><use class=""fa-external-link-alt"" xlink:href=""#fa-external-link-alt""></use></svg> also were the first non-native Spanish speakers to take the Advanced Placement Spanish Language class at Basalt High School and will be the first non-native Spanish speakers to earn the seal of biliteracy at the school, according to an earlier email from Moreno.</p> <p class=""oc-body"">Basalt High School’s long legacy of graduates earning the Chick Evans Scholarship for golf caddies also continues this year, according to Moreno’s email. Seniors <a href=""https://www.postindependent.com/news/basalt-seniors-use-caddy-skills-for-college-scholarships/"" target=""_blank"">Kyle Murray and Samuel Sherry</a><svg class=""svg-icon""><use class=""fa-external-link-alt"" xlink:href=""#fa-external-link-alt""></use></svg> earned the scholarship this year, which includes full tuition and housing at the University of Colorado, Boulder.</p> <p class=""oc-body"">The May school newsletter thanked 2022 graduates for their perseverance and grit. This year’s seniors, like the classes of 2021 and 2020 before them, had to navigate a host of pandemic and personal challenges in addition to the usual high school hurdles.</p> <p class=""oc-body"">“You have persevered through AP tests, graduation assessments, capstone projects, the loss of classmates, and a pandemic,” the newsletter states. “We could not be more proud of all that you have accomplished. Thank you for your hard work, your positive attitudes, your leadership, and your smiles. We will miss you and remember, you will always be Longhorns!”</p> <p class=""oc-body"">Basalt High School’s graduation ceremony is slated to take place at 10 a.m. Saturday inside the school in the main gym, according to a Facebook post that Roaring Fork School District shared around noon on Friday. (The ceremony usually happens on the football field outside, but Saturday’s forecast indicates potentially inclement weather.)</p> <p class=""oc-body""><em id=""emphasis-cde7212577086f75b638803cc4053d5c"">Editor’s note: This story has been updated to correct the spelling of Hanna Faulhaber’s name.</em></p> <p class=""oc-body""><a href=""mailto:kwilliams@aspentimes.com"">kwilliams@aspentimes.com</a></p> ",Kaya Williams,21 May 2022,https://www.aspentimes.com/news/six-rafters-including-four-children-saved-from-roaring-fork-rivers-strong-currents/
Longhorn seniors clear final hurdles to graduate from Basalt High School,"<img loading=""lazy"" width=""3600"" height=""683"" src=""https://imengine.public.prod.sci.navigacloud.com/?uuid=43db0f29-9f78-58c5-8347-f8648b7c866a&amp;type=preview&amp;width=3600&amp;height=2401&amp;q=60"" srcset=""https://imengine.public.prod.sci.navigacloud.com/?uuid=43db0f29-9f78-58c5-8347-f8648b7c866a&amp;type=preview&amp;width=300&amp;height=200&amp;q=60 300w,https://imengine.public.prod.sci.navigacloud.com/?uuid=43db0f29-9f78-58c5-8347-f8648b7c866a&amp;type=preview&amp;width=768&amp;height=512&amp;q=60 768w,https://imengine.public.prod.sci.navigacloud.com/?uuid=43db0f29-9f78-58c5-8347-f8648b7c866a&amp;type=preview&amp;width=1024&amp;height=683&amp;q=60 1024w,https://imengine.public.prod.sci.navigacloud.com/?uuid=43db0f29-9f78-58c5-8347-f8648b7c866a&amp;type=preview&amp;width=2048&amp;height=1366&amp;q=60 2048w"" alt=""""> <p class=""oc-body"">Andrew Huntsman and Ralph Smalley were chosen by the seniors to give the class address during Basalt High School’s graduation ceremony Saturday. This had the two BHS teachers questioning the legitimacy of those diplomas they were about to hand out.</p> <p class=""oc-body"">“Definitely not their first bad decision, and probably won’t be their last,” Huntsman quipped to <a href=""https://www.aspentimes.com/news/by-the-numbers-basalt-high-school-grads-have-big-plans-for-the-future/"">the Class of 2022</a> about its selection. “In reality, your class had to face a tremendous amount of adversity throughout school. Online school, in-person school, online slash in-person school, in-person school when the teachers were online, teachers mumbling through masks, and countless last-minute changes, like an indoor graduation.”</p> <p class=""oc-body"">Nearly 100 Basalt students graduated Saturday inside the BHS gymnasium. Normally held outside on the football field, an overnight winter storm forced school officials to move the event into the main gym.</p> <p class=""oc-body"">Just another hurdle to overcome for a class that has had to overcome its fair share of them over the past four years as Longhorns.</p> <p class=""oc-body"">“We all dealt with COVID, switching to online learning and the excitement of switching back to in-person. We made it past all the trials and tribulations and got to experience our senior year,” BHS Salutatorian Francesca Savi said during her speech.</p> <p class=""oc-body"">“For the last 13 years, we have grown together in both height and maturity. We have made mistakes and learned from them. We have built friendships and watched them fade. We have been through events in our community that others may never understand. We’ve had the fortune of having our teachers educate in a way that not only helps us with issues in the classroom, but also outside of the classroom, too.”</p> <p class=""oc-body"">BHS Principal Peter Mueller kicked off the ceremony, pointing out a handful of students. This included Marlon Nelson, whose bear hug of Mueller in the school hallway back in December when students returned to the classroom left quite the impression on the longtime administrator.</p> <img loading=""lazy"" width=""2400"" height=""819"" src=""https://imengine.public.prod.sci.navigacloud.com/?uuid=91234ccd-2a30-593e-a8b7-173a5482ac17&amp;type=preview&amp;width=2400&amp;height=1920&amp;q=60"" srcset=""https://imengine.public.prod.sci.navigacloud.com/?uuid=91234ccd-2a30-593e-a8b7-173a5482ac17&amp;type=preview&amp;width=300&amp;height=240&amp;q=60 300w,https://imengine.public.prod.sci.navigacloud.com/?uuid=91234ccd-2a30-593e-a8b7-173a5482ac17&amp;type=preview&amp;width=768&amp;height=614&amp;q=60 768w,https://imengine.public.prod.sci.navigacloud.com/?uuid=91234ccd-2a30-593e-a8b7-173a5482ac17&amp;type=preview&amp;width=1024&amp;height=819&amp;q=60 1024w,https://imengine.public.prod.sci.navigacloud.com/?uuid=91234ccd-2a30-593e-a8b7-173a5482ac17&amp;type=preview&amp;width=2048&amp;height=1638&amp;q=60 2048w"" alt=""""> <p class=""oc-body"">Then there was Hanna Faulhaber, who captivated the entire Roaring Fork Valley this winter <a href=""https://www.aspentimes.com/news/after-olympic-experience-faulhaber-ready-to-start-grinding-again/"">when she made the U.S. Olympic team for halfpipe skiing</a> and carved out some time during spring training to walk across the stage and graduate in person Saturday.</p> <p class=""oc-body"">“What I so appreciate about Marlon and this class is not just how you finished, but about how you learned in the process,” Mueller said. “The Class of 2022 has learned a lot these last four years. Overcoming adversity? Check. Seeing the joy in each other’s mask-free face? Check. Realizing that life is not about remote learning? Check, double check and check again.”</p> <p class=""oc-body"">Along with Savi, Valedictorian Emma Borchers addressed her classmates, bringing up her own personal struggles this past year that she hopes will only make her stronger as she heads to Dartmouth.</p> <p class=""oc-body"">“Personally, this past year was one of the most challenging of my life. I faced an event that no one could have prepared me for, one that flipped my life around,” Borchers said. “After this challenge, I emerged a better version of myself. I was prepared to work harder, in school and out of school, to prove to myself that the challenge I faced didn’t define me.”</p> <p class=""oc-body"">Before the seniors were allowed to walk across the stage, an impressive percentage of the class was recognized as having received the school district’s seal of biliteracy, and two new names were added to the school’s “Wall of Fame” in Gage Reuss and Zulma Garcia Rivas.</p> <p class=""oc-body"">“We wish we could tell you that the pandemic is over and everything will be easy. Unfortunately, life can be relentless and the challenges just keep coming,” Huntsman said during the class address.</p> <p class=""oc-body"">“This class has also taught us the necessity of sacrifice in order to succeed. So, if you want to be an Olympian, or if you want to be great at anything, you have to work at it. We know you will have opportunities to succeed, but it won’t come without a cost. It won’t come without dedication, hard work and finding joy in what you do. And you guys find joy really well.”</p> <p class=""oc-body"">Aspen High School’s graduation is scheduled for June 4.</p> <p class=""oc-body""><a href=""mailto:acolbert@aspentimes.com"">acolbert@aspentimes.com</a></p> ",Austin Colbert,22 May 2022,https://www.aspentimes.com/news/six-rafters-including-four-children-saved-from-roaring-fork-rivers-strong-currents/
Cyclists hit the road for Aspen’s annual Ride for the Pass on Sunday morning,"<img loading=""lazy"" width=""4032"" height=""768"" src=""https://imengine.public.prod.sci.navigacloud.com/?uuid=4fb80a37-06dd-594a-b8e7-6e692413ed1b&amp;type=preview&amp;width=4032&amp;height=3024&amp;q=60"" srcset=""https://imengine.public.prod.sci.navigacloud.com/?uuid=4fb80a37-06dd-594a-b8e7-6e692413ed1b&amp;type=preview&amp;width=300&amp;height=225&amp;q=60 300w,https://imengine.public.prod.sci.navigacloud.com/?uuid=4fb80a37-06dd-594a-b8e7-6e692413ed1b&amp;type=preview&amp;width=768&amp;height=576&amp;q=60 768w,https://imengine.public.prod.sci.navigacloud.com/?uuid=4fb80a37-06dd-594a-b8e7-6e692413ed1b&amp;type=preview&amp;width=1024&amp;height=768&amp;q=60 1024w,https://imengine.public.prod.sci.navigacloud.com/?uuid=4fb80a37-06dd-594a-b8e7-6e692413ed1b&amp;type=preview&amp;width=2048&amp;height=1536&amp;q=60 2048w"" alt=""""> <p class=""oc-body"">Competitive and recreational cyclists hit the road in droves on Sunday morning for the annual Ride for the Pass bike race and fundraising event.</p> <p class=""oc-body"">Proceeds supported the Independence Pass Foundation, a nonprofit with the mission “to restore and protect the ecological, historical, and aesthetic integrity of the Independence Pass corridor and to encourage stewardship, safety, and appreciation of the Pass,” according to its <a href=""https://www.independencepass.org/our-mission"" target=""_blank"">website</a><svg class=""svg-icon""><use class=""fa-external-link-alt"" xlink:href=""#fa-external-link-alt""></use></svg>.</p> <p class=""oc-body"">The race began at the winter closure gate on Highway 82 about 5 miles east of Aspen. The road up to the pass is closed to cars from November to May every year, giving springtime cyclists plenty of room to cruise. (The road is scheduled to open to cars at noon on May 26.)</p> <p class=""oc-body"">Participants could finish at the Weller Lake turnout just over 2 miles from the starting line or at the Independence ghost town near the top of the pass around 10 miles from the start. All Independence 10-mile riders were timed and included in competitive categories by age group; all Weller 2-mile riders were not timed. Riders could continue on their own to the summit of Independence Pass.</p> <p class=""oc-body"">A total of 147 riders completed the 10-mile ride to Independence, according to the race results.</p> <p class=""oc-body"">Markus Dewire won the 10-mile race to Independence with a time of 40 minutes and 47.1 seconds. Sami Inkinen was second with a time of 41:24.9, and Nicholas Galambos was third with a time of 44:08.2.</p> <p class=""oc-body"">Meredith Loring was the fastest woman with a time of 53 minutes, 34.5 seconds. She finished in 31st place overall. Jenya Berino finished second among women and 36th overall with a time of 54:32.5; Kellie Koswick was third among women and 54th overall with a time of 1 hour and 31.7 seconds.</p> <p class=""oc-body"">Full race results are available at <a href=""https://my.raceresult.com/196657/results#0_C1994E"" id=""link-767fd618bf6584e4ebf43035a6979a63"" target=""_self"" rel=""noopener"">my.raceresult.com/196657/results#0_C1994E</a>.</p> <p class=""oc-body"">The ride was originally slated for Saturday, but event organizers moved it to Sunday due to snow and cold temperatures in the forecast on the original date.</p> <p class=""oc-body"">For more information about the Independence Pass Foundation, visit <a href=""https://www.independencepass.org/our-mission"" target=""_blank"">independencepass.org</a><svg class=""svg-icon""><use class=""fa-external-link-alt"" xlink:href=""#fa-external-link-alt""></use></svg>.</p> ",Kaya Williams,23 May 2022,https://www.aspentimes.com/news/six-rafters-including-four-children-saved-from-roaring-fork-rivers-strong-currents/
Castle Creek Valley was site of two separate backcountry rescues this weekend,"<img loading=""lazy"" width=""1240"" height=""576"" src=""https://imengine.public.prod.sci.navigacloud.com/?uuid=c7d002f8-f786-5297-9f93-ae5bc3dbe114&amp;type=preview&amp;width=1240&amp;height=698&amp;q=60"" srcset=""https://imengine.public.prod.sci.navigacloud.com/?uuid=c7d002f8-f786-5297-9f93-ae5bc3dbe114&amp;type=preview&amp;width=300&amp;height=169&amp;q=60 300w,https://imengine.public.prod.sci.navigacloud.com/?uuid=c7d002f8-f786-5297-9f93-ae5bc3dbe114&amp;type=preview&amp;width=768&amp;height=432&amp;q=60 768w,https://imengine.public.prod.sci.navigacloud.com/?uuid=c7d002f8-f786-5297-9f93-ae5bc3dbe114&amp;type=preview&amp;width=1024&amp;height=576&amp;q=60 1024w,https://imengine.public.prod.sci.navigacloud.com/?uuid=c7d002f8-f786-5297-9f93-ae5bc3dbe114&amp;type=preview&amp;width=2048&amp;height=1153&amp;q=60 2048w"" alt=""""> <p class=""oc-body"">Rescuers headed to the Castle Creek Valley twice this weekend to respond to separate calls for help in the backcountry, one on Friday and one on Saturday.</p> <p class=""oc-body"">At approximately 12:40 p.m. Friday, the Pitkin County Sheriff’s Office “received a report of two campers in distress on the Conundrum Creek trail approximately 6 miles in,” according to a <a href=""https://docs.google.com/document/d/1sAWsQ2acWudhWiE74t92Uv5JcYRNu5YuFkoaEfVLLHs/edit"" target=""_blank"">news release</a><svg class=""svg-icon""><use class=""fa-external-link-alt"" xlink:href=""#fa-external-link-alt""></use></svg>.</p> <p class=""oc-body"">The Conundrum Creek trailhead is located about 7 miles outside of downtown Aspen via Castle Creek Road and Conundrum Creek Road. The trail is about 18 miles out and back to the popular Conundrum Hot Springs.</p> <p class=""oc-body"">The report indicated that “one of the campers was suffering from frostbite and unable to move. The campers, both in their 20s, also had several items of gear break and were unable to make food.”</p> <p class=""oc-body"">Friday’s weather was cold and snowy in Aspen, with temperatures dipping below freezing at times and heavy snow accumulating in the afternoon and evening.</p> <p class=""oc-body"">“Mountain Rescue Aspen (MRA) was immediately notified and mobilized,” according to the release. A ground team headed onto the Conundrum Creek trail to locate the campers around 2:30 p.m.</p> <p class=""oc-body"">The ground team made contact with the campers just after 5 p.m.</p> <p class=""oc-body"">“The campers did not have any serious injuries and were able to walk out on their own with assistance from MRA volunteers,” the release stated. A total of 17 Mountain Rescue Aspen members and the Pitkin County Sheriff’s Office contributed to the mission, and all members were safely out of the field by around 11:30 p.m.</p> <p class=""oc-body"">Rescuers also were out in the field on Saturday to respond to a report of an injured skier about 2 miles up the Cathedral Lake Trail.</p> <p class=""oc-body"">The Pitkin County Sheriff’s Office received the report around 12:20 p.m. indicating “the skier fell and sustained serious injuries,” according to a <a href=""https://docs.google.com/document/d/10h4XlPDZc7pWoPg9ii8NV4I-56K910KDzKYHIIICkl8/edit"" target=""_blank"">news release</a><svg class=""svg-icon""><use class=""fa-external-link-alt"" xlink:href=""#fa-external-link-alt""></use></svg>. The injured skier was accompanied by a second skier, but the report came from a passerby who saw the fall while he was hiking the Cathedral Lake Trail.</p> <p class=""oc-body"">The Cathedral Lake trailhead is located about 13.5 miles outside of downtown Aspen off of Castle Creek Road. The trail is about 5.6 miles out and back to Cathedral Lake through the Pine Creek Canyon.</p> <p class=""oc-body"">Again, “Mountain Rescue Aspen (MRA) was immediately notified and mobilized” to respond to the incident and sent a ground team onto the trail to locate the skier just before 1:20 p.m., according to a news release. A High-Altitude Aviation Training Site helicopter also was mobilized.</p> <p class=""oc-body"">In the meantime, Pitkin County Deputy Anthony Todaro also began climbing the trail to try to make contact.</p> <p class=""oc-body"">“At approximately 1:36 pm, Deputy Todaro had a visual on the injured skier and the skier’s partner,” the release stated.</p> <p class=""oc-body"">Mountain Rescue Aspen crews arrived at the scene just before 2:40 p.m. and the helicopter arrived “and successfully hoisted the injured skier into the helicopter” close to 3 p.m.</p> <p class=""oc-body"">“The injured skier was unresponsive and transported to the Aspen Pitkin County Airport where an ambulance from the Aspen Ambulance District had been staged to transport the injured skier to Aspen Valley Hospital,” the release stated.</p> <p class=""oc-body"">All told, “11 rescuers from Mountain Rescue Aspen, (the) High-Altitude Aviation Training Site, Aspen Ambulance District and the Pitkin County Sheriff’s Office contributed to the contributed to the safe and successful completion of this mission,“ according to the release. All responders were out of the field by around 5 p.m.</p> <p class=""oc-body"">The news releases for both incidents included reminders for backcountry caution and preparedness.</p> <p class=""oc-body"">“Mountain Rescue Aspen would like to remind people that in-between season conditions are variable and backcountry users need to be aware of seasonal transitions,” the release for the Cathedral Lake incident stated.</p> <p class=""oc-body""><a href=""mailto:kwilliams@aspentimes.com"">kwilliams@aspentimes.com</a></p> ",Kaya Williams,23 May 2022,https://www.aspentimes.com/news/six-rafters-including-four-children-saved-from-roaring-fork-rivers-strong-currents/
Driver dies in single-vehicle accident on Highway 82,"<p class=""oc-body"">A driver died in a single-vehicle accident on Highway 82 near Woody Creek early Sunday morning, according to Colorado State Patrol Master Trooper Gary Cutler and a <a href=""https://drive.google.com/file/d/1Xq42gdibEPq8l1pCWX5pfxtk_Sskxa38/view"" target=""_blank"">press release </a><svg class=""svg-icon""><use class=""fa-external-link-alt"" xlink:href=""#fa-external-link-alt""></use></svg>from Pitkin County Deputy Coroner John Young.</p> <p class=""oc-body"">Colorado State Patrol and the Pitkin County Coroner’s Office are investigating the crash, which occurred just before 6 a.m. Sunday, the release states.</p> <p class=""oc-body"">The coroner’s office identified the driver as 39-year-old Francisco Javier Olivares of Aspen.</p> <p class=""oc-body"">There was only one person in the car at the time of the accident, according to Cutler, who also is a public information officer for the Colorado State Patrol.</p> <p class=""oc-body"">The driver was heading upvalley “when his car left the road, hit a water culvert, and then rolled several times,” according to the release. The Pitkin County Regional Dispatch Center received “reports of a car on its roof” at 5:52 a.m.</p> <p class=""oc-body"">“(Emergency medical services) crews and police were dispatched and arrived on the scene very quickly, but by all reports Francisco had already succumbed to his injuries,” the release stated.</p> <p class=""oc-body"">“The manner and cause of death are still pending a post-mortem investigation as is standard in fatal vehicle crashes,” according to the release. “The Coroner’s Office will release more details as they become available.”</p> <p class=""oc-body"">The accident occurred near mile marker 33 on Highway 82, according to Cutler. That highway milepost is almost directly across from the town of Woody Creek, according to an online map from the state of Colorado. It’s about two miles west of the Brush Creek Park and Ride.</p> <p class=""oc-body""><a href=""mailto:kwilliams@aspentimes.com"" id=""link-b5f42184b48b5b9ead000cca6c3c2dda"" target=""_self"" rel=""noopener""><em id=""emphasis-06eb54ed47a95dd1924c5ff07ce3e48a""><a href=""mailto:kwilliams@aspentimes.com"">kwilliams@aspentimes.com</a></em></a></p> ",Kaya Williams,23 May 2022,https://www.aspentimes.com/news/six-rafters-including-four-children-saved-from-roaring-fork-rivers-strong-currents/
