Title,Text,Author,Date,Url
Ambitious plan for preventing development on Roaring Fork region land,"<img loading=""lazy"" width=""6000"" height=""683"" src=""https://imengine.public.prod.sci.navigacloud.com/?uuid=36949275-5c56-5fbc-9cb0-e94ef075994c&amp;type=preview&amp;width=6000&amp;height=4000&amp;q=60"" srcset=""https://imengine.public.prod.sci.navigacloud.com/?uuid=36949275-5c56-5fbc-9cb0-e94ef075994c&amp;type=preview&amp;width=300&amp;height=200&amp;q=60 300w,https://imengine.public.prod.sci.navigacloud.com/?uuid=36949275-5c56-5fbc-9cb0-e94ef075994c&amp;type=preview&amp;width=768&amp;height=512&amp;q=60 768w,https://imengine.public.prod.sci.navigacloud.com/?uuid=36949275-5c56-5fbc-9cb0-e94ef075994c&amp;type=preview&amp;width=1024&amp;height=683&amp;q=60 1024w,https://imengine.public.prod.sci.navigacloud.com/?uuid=36949275-5c56-5fbc-9cb0-e94ef075994c&amp;type=preview&amp;width=2048&amp;height=1365&amp;q=60 2048w"" alt=""""> <p class=""oc-body"">The oldest land trust in Colorado, Aspen Valley Land Trust has set an ambitious goal to double the amount of land that it has spared from development in the next decade.</p> <p class=""oc-body"">The trust has purchased land or acquired conservation easements on 45,000 acres in the Roaring Fork and Lower Colorado River valleys in the past 55 years. The nonprofit organization’s new strategic plan calls for conserving another 40,000 to 50,000 acres in just the next decade.</p> <p class=""oc-body"">A map of AVLT’s protected lands shows it has historically been slightly more active in the Roaring Fork Valley than in the Lower Colorado River Valley. It has conserved 24,166 acres between Aspen and Glenwood Springs and offshoot valleys. It has conserved 20,766 acres in the ranchlands and farm country surrounding New Castle, Silt, Rifle and Parachute. The balance is likely to shift over the next decade.</p> <p class=""oc-body"">“There are some large parcels left in the Roaring Fork Valley, but by and large most of the opportunity is in the Colorado River Valley,” said Suzanne Stephens, the executive director of AVLT for the past six years.</p> <p class=""oc-body"">It will be a hefty challenge to conserve land anywhere thanks to soaring land prices, but AVLT is undaunted. One big advantage is that Colorado has significantly sweetened the incentives. The tax credit offered by the state for conservation used to be 50 cents on the dollar. It has been boosted to 90 cents, according to Stephens.</p> <p class=""oc-body"">With few exceptions, AVLT depends on voluntary agreements with landowners rather than outright purchases of property. When it acquires a conservation easement, the landowner retains ownership but limits or surrenders development potential in return for tax credits. The appeal is often that the tax credits can often be used as revenue to plow back into a farm or ranch, Stephens said.</p> <p class=""oc-body"">Another challenge is some of the targeted land is also property ripe for development of affordable housing — a dire need throughout the region. AVLT is acutely aware of needs beyond preservation of open space.</p> <p class=""oc-body"">“We’re not just here to commit random acts of conservation,” Stephens said in a meeting Thursday with the Pitkin County Open Space and Trails program’s board of directors.</p> <p class=""oc-body"">After the meeting, she said communities could achieve preservation of open space and development of affordable housing with proper planning.</p> <p class=""oc-body"">“I truly, truly don’t think it needs to adversarial,” she said.</p> <p class=""oc-body"">AVLT’s target area stretches from the Continental Divide east of Aspen to the Roan Plateau west of Parachute. That area encompasses 2.1 million acres, with the vast majority held by public land management agencies. According to AVLT statistics, 42% of the area is national forest, 21% Bureau of Land Management holdings and about 1% held by Colorado Parks and Wildlife and local open space programs.</p> <img loading=""lazy"" width=""1070"" height=""565"" src=""https://imengine.public.prod.sci.navigacloud.com/?uuid=8ba424dd-34b0-5855-80c1-27fef5f5a2b6&amp;type=preview&amp;width=1070&amp;height=590&amp;q=60"" srcset=""https://imengine.public.prod.sci.navigacloud.com/?uuid=8ba424dd-34b0-5855-80c1-27fef5f5a2b6&amp;type=preview&amp;width=300&amp;height=165&amp;q=60 300w,https://imengine.public.prod.sci.navigacloud.com/?uuid=8ba424dd-34b0-5855-80c1-27fef5f5a2b6&amp;type=preview&amp;width=768&amp;height=423&amp;q=60 768w,https://imengine.public.prod.sci.navigacloud.com/?uuid=8ba424dd-34b0-5855-80c1-27fef5f5a2b6&amp;type=preview&amp;width=1024&amp;height=565&amp;q=60 1024w,https://imengine.public.prod.sci.navigacloud.com/?uuid=8ba424dd-34b0-5855-80c1-27fef5f5a2b6&amp;type=preview&amp;width=2048&amp;height=1129&amp;q=60 2048w"" alt=""""> <p class=""oc-body"">That leaves 35% as private land, but the importance of that land to wildlife and food production can’t be exaggerated.</p> <p class=""oc-body"">“Generally, public land occupies the higher elevations and peaks and private land covers the lower elevations and valleys,” AVLT’s website said. “The valley bottoms and lower elevations are often the most rich and productive for both wildlife and humans; they are also the most highly threatened by growth and development pressure.”</p> <p class=""oc-body"">To craft its strategic plan, AVLT engaged in an extensive public engagement process where it consulted with 550 people through open houses, surveys, interviews and meetings with municipal officials. That input will help determine what lands to pursue. The plan spells out specifically the types of qualities the organization is seeking in property is conserves.</p> <p class=""oc-body"">The priorities include some of the obvious attributes:</p> <p class=""oc-body"">But AVLT is also looking for opportunities that provide less obvious advantages. The organization wants to promote equity by expanding outdoor access for communities with the highest need. Stephens said conservation groups run the risk of sinking into irrelevancy when not catering to all segments of local constituents.</p> <p class=""oc-body"">The organization will also gauge acquisitions by the potential to provide recreational and education for local residents.</p> <p class=""oc-body"">A final factor is acquisitions that help with climate resilience.</p> <p class=""oc-body"">To date, AVLT has protected 67 square miles, the equivalent of a strip 1 mile wide from Aspen to Rifle. If it successfully achieves its goal, that will double by 2032.</p> <p class=""oc-body""><em id=""emphasis-29a433fc1e8dec5581289e0d17903c41""><a href=""mailto:scondon@aspentimes.com"">scondon@aspentimes.com</a></em></p> ",Scott Condon,08 May 2022,https://www.aspentimes.com/news/core-act-has-an-important-meeting-set-for-tuesday/
Veterinarian’s report details incomplete vaccinations at Colorado facility where 94 horses died,"<img loading=""lazy"" width=""7360"" height=""683"" src=""https://imengine.public.prod.sci.navigacloud.com/?uuid=6f9cf8c3-37d0-53cd-8773-7888f7cddf68&amp;type=preview&amp;width=7360&amp;height=4912&amp;q=60"" srcset=""https://imengine.public.prod.sci.navigacloud.com/?uuid=6f9cf8c3-37d0-53cd-8773-7888f7cddf68&amp;type=preview&amp;width=300&amp;height=200&amp;q=60 300w,https://imengine.public.prod.sci.navigacloud.com/?uuid=6f9cf8c3-37d0-53cd-8773-7888f7cddf68&amp;type=preview&amp;width=768&amp;height=513&amp;q=60 768w,https://imengine.public.prod.sci.navigacloud.com/?uuid=6f9cf8c3-37d0-53cd-8773-7888f7cddf68&amp;type=preview&amp;width=1024&amp;height=683&amp;q=60 1024w,https://imengine.public.prod.sci.navigacloud.com/?uuid=6f9cf8c3-37d0-53cd-8773-7888f7cddf68&amp;type=preview&amp;width=2048&amp;height=1367&amp;q=60 2048w"" alt=""""> <p class=""oc-body"">The Bureau of Land Management suspects equine influenza virus H3N8, a virus common among wild and domestic horses, has caused the deaths of 94 horses since April 23 at a Cañon City holding facility.</p> <p class=""oc-body"">There are more than 2,500 wild horses at the facility, including most of the horses gathered from the <a href=""https://www.steamboatpilot.com/news/devoid-of-life-soon-there-will-be-just-163-wild-horses-left-in-famous-sand-wash-basin-herd-after-blm-roundup/"" target=""_blank"">famous Sand Wash Basin herd in Moffat County last fall</a><svg class=""svg-icon""><use class=""fa-external-link-alt"" xlink:href=""#fa-external-link-alt""></use></svg>, but the illness is mostly spreading among horses captured from the West Douglas Herd Area, 5 miles south of Rangely, according to a <a href=""https://www.blm.gov/press-release/virus-has-been-identified-principal-cause-outbreak-and-mortality-blms-wild-horse-and"" target=""_blank"">news release </a><svg class=""svg-icon""><use class=""fa-external-link-alt"" xlink:href=""#fa-external-link-alt""></use></svg>on Thursday, April 28.</p> <p class=""oc-body"">The release said polymerase chain reaction (PCR) laboratory test results from two laboratories found the virus in several horses.</p> <p class=""oc-body"">A <a href=""https://www.blm.gov/sites/blm.gov/files/docs/2022-04/Canon%20City%20site%20visit_mortalityinvestigation4_26_22%20w_addendum4_28_22.pdf"" target=""_blank"">report completed by USDA Animal and Plant Health Inspection Service veterinarian Dr. Albert Kane </a><svg class=""svg-icon""><use class=""fa-external-link-alt"" xlink:href=""#fa-external-link-alt""></use></svg>on Thursday noted that while the pneumonia-like illness has been deadly for the West Douglas horses, symptoms have been mild among other horses at the facility.</p> <p class=""oc-body"">Kane’s report also stated that the West Douglas horses were partially vaccinated or unvaccinated, which could be a factor in the spread of the illness. He said the initial illness arose five to 10 days after a group of 50 horses received their first vaccinations and appeared first and most severely in that same group of horses.</p> <p class=""oc-body"">The West Douglas horses were captured in early August 2021 and should have been vaccinated shortly thereafter, according to BLM Colorado Spokesperson Steven Hall.</p> <p class=""oc-body"">“Part of our review of what happened in this situation, is to determine why these horses hadn’t been vaccinated,” Hall said. “Was there an issue with resources? Was there with a number of horses at the facility? Was there an issue with COVID? We’re trying to determine what the factors were that led to these horses not being vaccinated.”</p> <p class=""oc-body"">The BLM website states that “vaccines for adult horses and burros are administered and boostered as soon as possible after the animals arrive at a corral facility. It is a race against time to build immunity by vaccination while the animals are increasingly exposed to these viruses and bacteria in their new environment. Unfortunately, the respiratory diseases (flu, rhino and strangles) are highly contagious and difficult to control through vaccination alone. The vaccines may help limit how quickly and severely the illness spreads in a group setting.”</p> <p class=""oc-body"">Kane’s report also suggested the West Douglas horses could have been compromised by smoke from the Oil Springs Fire, which burned 12,613 acres in the summer of 2021, including much of the herd’s range.</p> <p class=""oc-body"">Thursday’s news release said 95 horses have died from the illness, but the death of a foal on April 18 has been deemed unrelated. As of Friday, April 29, Hall said there have been no additional deaths since Thursday.</p> <p class=""oc-body"">The <a href=""https://americanwildhorsecampaign.org/media/57-federally-protected-wild-horses-dead-colorado-taxpayer-funded-holding-facility"" target=""_blank"">American Wild Horse Campaign</a><svg class=""svg-icon""><use class=""fa-external-link-alt"" xlink:href=""#fa-external-link-alt""></use></svg>, which has sharply criticized the deaths, is calling on Colorado Gov. Jared Polis and state and federal policymakers to halt all wild horse roundups until the Cañon City investigation is complete.</p> <p class=""oc-body"">“The suspension of roundups is imperative,” the advocacy group said in a news release on Friday, adding that a roundup is scheduled this summer for the Piceance-East Douglas herd outside of Meeker.</p> <p class=""oc-body"">The outbreak has also <a href=""https://www.steamboatpilot.com/news/sand-wash-basin-horses-wont-be-used-at-mustang-makeover-amid-outbreak-of-unknown-illness/"" target=""_blank"">canceled adoption events and prevented Sand Wash Basin horses from being a part of the Meeker Mustang Makeover</a><svg class=""svg-icon""><use class=""fa-external-link-alt"" xlink:href=""#fa-external-link-alt""></use></svg>.</p> ",Shelby Reardon,03 May 2022,https://www.aspentimes.com/news/core-act-has-an-important-meeting-set-for-tuesday/
Sandhill crane chick’s arrival near Steamboat captured by camera,"<p class=""oc-body"">It was not difficult to hear the excitement in Nancy Merrill’s voice as she talked about capturing the arrival of one our area’s most anticipated babies on the Crane Camera on Tuesday.</p> <p class=""oc-body"">“It’s a huge day,” said Merrill, president of the Colorado Crane Conservation Coalition. “We are so thrilled because they lost an egg Sunday (May 8) on Mother’s Day, and were devastated. So they’ve been sitting on the other egg patiently, and it hatched this morning at 10:40.”</p> <p class=""oc-body"">The cranes, Fred and Wilma, have been taking turns sitting on the egg. Fred was on duty when the new chick hatched. Merrill was watching her screen and waiting for Wilma’s arrival as she talked on the phone Tuesday morning.</p> <p class=""oc-body"">“It was so interesting because the egg hatched while the father was on the nest,” Merrill said. “The mother is just coming back right now as we’re speaking to see her chick for the first time.”</p> <p class=""oc-body"">Merrill said moments like these are why the <a href=""https://www.steamboatpilot.com/news/camera-offers-glimpse-inside/"" target=""_blank"">Colorado Crane Conservation Coalition put the camera in place in an undisclosed location west of Steamboat Springs</a><svg class=""svg-icon""><use class=""fa-external-link-alt"" xlink:href=""#fa-external-link-alt""></use></svg> two years ago. She said this year, thanks to donations, the equipment was upgraded and has been far more reliable.</p> <p class=""oc-body"">The only glitch came early on, when the group had to move the camera at the last moment, after the cranes that were featured on the camera last year decided to nest in a different location away from the camera’s ideal field of view.</p> <p class=""oc-body"">Volunteers quickly moved the camera to a new location earlier this spring. It was a little farther away from the nest, but Fred and Wilma were not disturbed when the camera was moved.</p> <p class=""oc-body"">“The best thing is the crane message is getting out to the world with everybody who is watching this,” Merrill said. “We’re taping everything so that we can play it back for everyone who missed it, and we’re pretty excited about it.”</p> <p class=""oc-body"">Merrill said the new baby arrived in the expected window about 30 days after the egg was laid on April 15. A second egg was laid a few days later, but it broke.</p> <p class=""oc-body"">The group sent out about 2,000 emails last week letting people know that this was a good time to start watching the live feed if they wanted to see the chick’s arrival. She added that some of the crane camera’s highlight videos have been viewed up to 8,000 times. She expects this video of the father standing up and the new chick taking it’s first stroll to get lots of views, as well.</p> <p class=""oc-body"">“It just stood up and walked around,” Merrill said. “I mean, it was just so adorable.”</p> <p class=""oc-body"">She said crane chicks are precocial, meaning that they are able to see right away, and feed almost immediately. They actually can get up and leave the nest within a day. Merrill said that while they could anticipate the hatch, what happens afterward is much harder to predict. She said some cranes will hang out around the nest for a few days while others leave more quickly. She said the camera will continue to broadcast until the cranes leave the area.</p> <p class=""oc-body"">“Often they will come back to the nest at night, but sometimes it won’t,” Merrill said. “Sometimes once they leave the nest we don’t really know how long they’re going to stick around.”</p> <p class=""oc-body"">The good news is that the events since the cranes started nesting in mid-April have all been recorded and are available to the <a href=""https://coloradocranes.org/"" target=""_blank"">Colorado Crane Conservation Coalition</a><svg class=""svg-icon""><use class=""fa-external-link-alt"" xlink:href=""#fa-external-link-alt""></use></svg> website. There, viewers can watch the chick hatch, the parents fend off raccoons and skunks, as well as build the nest. The camera also captured American white pelicans and a great blue heron visiting the area where the crane nest is located.</p> <p class=""oc-body"">The <a href=""https://www.youtube.com/watch?v=8w3E5PCSqx8"" target=""_blank"">live video feed </a><svg class=""svg-icon""><use class=""fa-external-link-alt"" xlink:href=""#fa-external-link-alt""></use></svg>is made possible through grants provided by the Yampa Valley Community Foundation and the WHILD fund. Internet access for live streaming is provided by Zirkel Wireless. Camera installation and setup were completed by Photon Syndicate.</p> <p class=""oc-body"">“Our organization is all about trying to keep those wetlands and open spaces for the cranes and all the other critters that live there,” Merrill said. “When you see this miracle of hatching it just inspires you to work that much harder for it.”</p> ",John F. Russell,18 May 2022,https://www.aspentimes.com/news/core-act-has-an-important-meeting-set-for-tuesday/
"Bennet bill would create endowment to aid Hayden, Craig as coal-fired plants shutter","<img loading=""lazy"" width=""7360"" height=""683"" src=""https://imengine.public.prod.sci.navigacloud.com/?uuid=49e1d239-373f-51bb-9d4b-032b086b0fe7&amp;type=preview&amp;width=7360&amp;height=4912&amp;q=60"" srcset=""https://imengine.public.prod.sci.navigacloud.com/?uuid=49e1d239-373f-51bb-9d4b-032b086b0fe7&amp;type=preview&amp;width=300&amp;height=200&amp;q=60 300w,https://imengine.public.prod.sci.navigacloud.com/?uuid=49e1d239-373f-51bb-9d4b-032b086b0fe7&amp;type=preview&amp;width=768&amp;height=513&amp;q=60 768w,https://imengine.public.prod.sci.navigacloud.com/?uuid=49e1d239-373f-51bb-9d4b-032b086b0fe7&amp;type=preview&amp;width=1024&amp;height=683&amp;q=60 1024w,https://imengine.public.prod.sci.navigacloud.com/?uuid=49e1d239-373f-51bb-9d4b-032b086b0fe7&amp;type=preview&amp;width=2048&amp;height=1367&amp;q=60 2048w"" alt=""""> <p class=""oc-body"">Hayden’s new school was built with a sizable grant and the support of the community as residents approved the more than $22 million school bond measure in 2017 by just two votes.</p> <p class=""oc-body"">But more than half of that bond funding comes from one source: Hayden Station.</p> <p class=""oc-body"">“(The school bond) is 55% dependent on the Hayden Station,” said Mayor Zach Wuestewald. “Our fire district, library district, hospital district and cemetery district rely on this asset for property taxes that range anywhere from 55% to 65% of their total budget.”</p> <p class=""oc-body"">Xcel Energy intends to close both units at the Hayden Station by the end of 2028.</p> <p class=""oc-body"">The three generating stations 17 miles to the west in <a href=""https://www.craigdailypress.com/news/tri-state-leadership-gives-more-details-of-craig-station-unit-1-closure-colowyo-mines-collom-expansion/"" target=""_blank"">Craig are slated to close in 2025, 2028 and 2030.</a><svg class=""svg-icon""><use class=""fa-external-link-alt"" xlink:href=""#fa-external-link-alt""></use></svg> In 2020, more than 60% of all of the assessed value in Moffat County came from 10 energy related taxpayers, <a href=""https://www.kunc.org/news/2022-01-24/craig-colorado-grapples-with-the-future-as-its-coal-mine-and-power-plant-shut-down"" target=""_blank"">according to KUNC.</a><svg class=""svg-icon""><use class=""fa-external-link-alt"" xlink:href=""#fa-external-link-alt""></use></svg></p> <p class=""oc-body"">The two Northwest Colorado communities stand to benefit from a bill introduced by Colorado U.S. Sen. Michael Bennet on Wednesday that would create a $20 billion endowment fund to help diversify the economies of transitioning coal communities.</p> <p class=""oc-body"">The bill, called the National Energy Community Transition Act, would offer these communities formula payments sent annually to help pay for core public services, transition grants that could be used for planning and capacity building, and investments in specific local projects.</p> <p class=""oc-body"">“I have heard time and again from Coloradans about the effects of coal mine and power plant closures have on our rural communities and their economies,” Bennet, a Democrat, said in a statement. “My legislation was carefully crafted with feedback from local leaders in Northwest Colorado to create an enduring way to support economic revitalization.”</p> <img loading=""lazy"" width=""4032"" height=""768"" src=""https://imengine.public.prod.sci.navigacloud.com/?uuid=41c7db38-55ea-5f3e-a4c9-6d238f24f0e8&amp;type=preview&amp;width=4032&amp;height=3024&amp;q=60"" srcset=""https://imengine.public.prod.sci.navigacloud.com/?uuid=41c7db38-55ea-5f3e-a4c9-6d238f24f0e8&amp;type=preview&amp;width=300&amp;height=225&amp;q=60 300w,https://imengine.public.prod.sci.navigacloud.com/?uuid=41c7db38-55ea-5f3e-a4c9-6d238f24f0e8&amp;type=preview&amp;width=768&amp;height=576&amp;q=60 768w,https://imengine.public.prod.sci.navigacloud.com/?uuid=41c7db38-55ea-5f3e-a4c9-6d238f24f0e8&amp;type=preview&amp;width=1024&amp;height=768&amp;q=60 1024w,https://imengine.public.prod.sci.navigacloud.com/?uuid=41c7db38-55ea-5f3e-a4c9-6d238f24f0e8&amp;type=preview&amp;width=2048&amp;height=1536&amp;q=60 2048w"" alt=""""> <p class=""oc-body"">The endowment would have two accounts, with a permanent account starting with $20 billion that would live in perpetuity. A second account would be filled with unobligated federal fossil fuel and renewable energy leasing revenues.</p> <p class=""oc-body"">The endowment would be invested with the goal of making a 5% return.</p> <p class=""oc-body"">The bill would also create a new federally chartered nonprofit called the Community Revitalization Corporation that would be overseen by a board of between seven and 11 members appointed by the president and approved by the U.S. Senate. Initially, at least one board member would need to be from each of the six different regions identified across the country.</p> <p class=""oc-body"">“I believe we must think regionally about sustainable and long-term community development,” said Routt County Commissioner Tim Redmond. “The endowment concept will allow for long-term planning and success.”</p> <img loading=""lazy"" width=""7360"" height=""683"" src=""https://imengine.public.prod.sci.navigacloud.com/?uuid=6d55f781-2923-51ff-bbf7-218c408a7e3c&amp;type=preview&amp;width=7360&amp;height=4912&amp;q=60"" srcset=""https://imengine.public.prod.sci.navigacloud.com/?uuid=6d55f781-2923-51ff-bbf7-218c408a7e3c&amp;type=preview&amp;width=300&amp;height=200&amp;q=60 300w,https://imengine.public.prod.sci.navigacloud.com/?uuid=6d55f781-2923-51ff-bbf7-218c408a7e3c&amp;type=preview&amp;width=768&amp;height=513&amp;q=60 768w,https://imengine.public.prod.sci.navigacloud.com/?uuid=6d55f781-2923-51ff-bbf7-218c408a7e3c&amp;type=preview&amp;width=1024&amp;height=683&amp;q=60 1024w,https://imengine.public.prod.sci.navigacloud.com/?uuid=6d55f781-2923-51ff-bbf7-218c408a7e3c&amp;type=preview&amp;width=2048&amp;height=1367&amp;q=60 2048w"" alt=""""> <p class=""oc-body"">Ryan Hess, mayor of Craig, said in a statement that the bill was worked on with local leaders on both sides of the political aisle and would help communities like Craig transition as its coal-based economy fades.</p> <p class=""oc-body"">“We believe this proposal is grounded in rural Colorado and would provide the necessary and sustained support to refocus, retool and revitalize Craig and our region,” Hess said.</p> <p class=""oc-body"">At a roundtable discussion in Craig last year, local officials highlighted the need to get ahead of the “fiscal cliff” many of these small communities are facing when these plants close. Moffat County Commissioner Melody Villard said Bennet modified the bill after that local consultation and believed it will help communities like Craig embrace the future while honoring the industry that built the community.</p> <p class=""oc-body"">“We believe the endowment concept has the ability to do just that,” Villard said.</p> ",Dylan Anderson,12 May 2022,https://www.aspentimes.com/news/core-act-has-an-important-meeting-set-for-tuesday/
