Title,Text,Author,Date,Url
Warrant active for man accused of ripping off Aspen restaurants,"<p class=""oc-body"">A man is wanted for failing to appear in court last week to answer charges that he allegedly stole fine cigars and a bottle of wine from an Aspen liquor store and refused to pay for two restaurant meals because he said one was tainted with pork and the other with hair.</p> <p class=""oc-body"">Pitkin County Judge Ashley Andrews issued a warrant for the arrest of Shawn Auer at the close of courthouse hours May 17 after he allegedly failed to appear for a status conference concerning a multitude of offenses he faces. The charges recently were consolidated into one case.</p> <p class=""oc-body"">“I’m concerned that there could be a another theft and really I’m concerned Mr. Auer is not going to show up for court,” said prosecutor Wes Stokes, noting Auer’s criminal history includes charges of shoplifting and theft in New Mexico, where he also failed to make scheduled court appearances. Stokes’ remarks came during last week’s court session where Auer was a no-show.</p> <img loading=""lazy"" width=""357"" height=""1251"" src=""https://imengine.public.prod.sci.navigacloud.com/?uuid=c9eb061c-4960-5c8f-89dc-a405fafa71b1&amp;type=preview&amp;width=357&amp;height=436&amp;q=60"" srcset=""https://imengine.public.prod.sci.navigacloud.com/?uuid=c9eb061c-4960-5c8f-89dc-a405fafa71b1&amp;type=preview&amp;width=300&amp;height=366&amp;q=60 300w,https://imengine.public.prod.sci.navigacloud.com/?uuid=c9eb061c-4960-5c8f-89dc-a405fafa71b1&amp;type=preview&amp;width=768&amp;height=938&amp;q=60 768w,https://imengine.public.prod.sci.navigacloud.com/?uuid=c9eb061c-4960-5c8f-89dc-a405fafa71b1&amp;type=preview&amp;width=1024&amp;height=1251&amp;q=60 1024w,https://imengine.public.prod.sci.navigacloud.com/?uuid=c9eb061c-4960-5c8f-89dc-a405fafa71b1&amp;type=preview&amp;width=2048&amp;height=2501&amp;q=60 2048w"" alt=""""> <p class=""oc-body"">Charging documents for Auer list his current residence as Belleville, Illinois, and his age as 48. He remained at large as of Monday, according to officials.</p> <p class=""oc-body"">Auer’s recent dust-ups at local businesses are documented in police filings.</p> <p class=""oc-body"">• May 6 — Aspen police were called to Steakhouse 316 on East Hopkins Avenue for report of a patron who was unhappy with his meal because of a strand of hair he claimed was in his food. The diner, Auer, was comped for the food containing the hair but refused to pay for the rest of the meal, according to a police report.</p> <p class=""oc-body"">“Auer adamantly refused to pay his bill and I explained to him that if he has an issue with the restaurant what avenues he could take, but he can’t eat and drink and not pay his bill,” responding Officer Amanda Severin wrote in the report. “Auer didn’t seem to care. I asked him numerous times if he would pay the bill and Auer said he will not pay the bill and to arrest him.”</p> <p class=""oc-body"">Police did that and took him to Aspen Police Department and an officer issued a summons for misdemeanor theft, read him his rights and told him not to return to the restaurant or face trespassing charges.</p> <p class=""oc-body"">• May 13 — Shortly after 7 p.m., police arrested Auer at the Red Mountain Grill at the Aspen Golf Course after he allegedly refused to pay a bill for a meal he had there earlier in the week. Auer was on the premises that day looking for rental clubs, and Red Mountain Grill management had kept the receipt for his unpaid meal from days earlier. When a manager confronted Auer about the outstanding receipt, “Auer became belligerent with the staff by yelling and cussing at them, and posturing like he was going to fight,” according to a witness statement to police.</p> <p class=""oc-body"">Police arrived and Auer denied any wrongdoing, according to a report from Officer Severin, who had cited him a week earlier for the hair-in-the-food dispute.</p> <p class=""oc-body"">“I told Auer he is making it a habit of eating at places and refusing to pay,” said Severin’s report of the May 13 incident. “Auer yelled at me that Red Mountain Grill poisoned him by serving him pork.”</p> <p class=""oc-body"">Auer had previously complained that the restaurant staff had “poisoned him” because he’s “100% Jewish” and can’t consume pork.</p> <p class=""oc-body"">Management also said Auer had been scheduling tee times at the course under the name of “Leo Christ” but was not keeping his appointments.</p> <p class=""oc-body"">Again, police took Auer took to downtown headquarters where he was summonsed for misdemeanor theft and disorderly conduct. Police also let Auer know he’d been 86ed from Red Mountain Grill and the golf club. He was then released from custody.</p> <p class=""oc-body"">• May 13 — Later on that date, at approximately 9:01 p.m., police received a call from The Aspen Store about a man who swiped some power drinks and was behaving aggressively toward the store clerk. Auer was not at the store at the time police responded, but Officer Ritchie Zah located him down the block in the dining area outside of Mi Chola, according to a report from Officer Roderick O’Connor.</p> <p class=""oc-body"">“I asked Auer, who was smoking a cigar, about his stealing drinks from The Aspen Store and where the bag he took was located,” O’Connor’s report said. “Auer was not forthcoming about the bag, but mentioned he was at Mi Chola to eat.”</p> <p class=""oc-body"">O’Connor, however, arrested Auer for theft after he found the power drinks in a bag Auer had left inside the restaurant. It was the second time in the same evening Auer had been cited for theft, but the pork meal and power drinks weren’t all he had allegedly taken.</p> <p class=""oc-body"">Officer Severin, who also reported to Mi Chola, also found Auer in possession of one bottle of Opus One Cabernet with a price tag of $389.99, along with four cigars valued at $52.87. Those items had been swiped from the Local Spirits shop next to The Aspen Store, O’Connor reported.</p> <p class=""oc-body"">Auer appeared for his advisement on May 14, but that is the last authorities had heard of him as of Monday.</p> <p class=""oc-body""><em id=""emphasis-8c75815ae60d46994ffbeed1ab926cd9""><a href=""mailto:rcarroll@aspentimes.com"">rcarroll@aspentimes.com</a></em></p> ",Rick Carroll,24 May 2022,https://www.aspentimes.com/news/six-rafters-including-four-children-saved-from-roaring-fork-rivers-strong-currents/
Foodstuff: Notorious fan of cookbooks,"<img loading=""lazy"" width=""4032"" height=""768"" src=""https://imengine.public.prod.sci.navigacloud.com/?uuid=373f1f39-b8b3-5036-91f3-6a1176730c82&amp;type=preview&amp;width=4032&amp;height=3024&amp;q=60"" srcset=""https://imengine.public.prod.sci.navigacloud.com/?uuid=373f1f39-b8b3-5036-91f3-6a1176730c82&amp;type=preview&amp;width=300&amp;height=225&amp;q=60 300w,https://imengine.public.prod.sci.navigacloud.com/?uuid=373f1f39-b8b3-5036-91f3-6a1176730c82&amp;type=preview&amp;width=768&amp;height=576&amp;q=60 768w,https://imengine.public.prod.sci.navigacloud.com/?uuid=373f1f39-b8b3-5036-91f3-6a1176730c82&amp;type=preview&amp;width=1024&amp;height=768&amp;q=60 1024w,https://imengine.public.prod.sci.navigacloud.com/?uuid=373f1f39-b8b3-5036-91f3-6a1176730c82&amp;type=preview&amp;width=2048&amp;height=1536&amp;q=60 2048w"" alt=""""> <p class=""oc-body"">Late last week, as I corralled some friends into my kitchen for a cozy offseason cooknight, we happened upon the subject of notoriety.</p> <p class=""oc-body"">Someone — Liz, probably, or maybe Hannah or Henry — had proposed a summer outdoor cookout. It had been done before, Hannah said: Legend has it some guy used to hike up Buttermilk and cook hot dogs at the top of Tiehack. We weren’t sure who, but much of the evidence pointed to a dear friend who I’d consider “a notorious fan of hot dogs.”</p> <p class=""oc-body"">Which prompted a follow-up: What foodstuffs were we “notorious fans” of? After some lengthy mulling, Henry landed on raw meat and fish of the tartare and sushi varieties. But it took less than 30 seconds to determine where my reputation lies: “a notorious fan of cookbooks” was the obvious answer.</p> <p class=""oc-body"">I’ll be the first to acknowledge that my enthusiasm for recipes might come off as “a bit much.” I’ve covered a wall in my living room with the back covers of Cook’s Illustrated magazine and lined the table below end to end with recipe collections and kitchen-adjacent literature. “The Cookbook Collector,” a novel I devoured, is in that stack; maybe a little too on the nose, eh?</p> <p class=""oc-body"">But I also believe this enthusiasm is warranted, especially for the old yarns and great fun that I find in reading old lists of ingredients and instructions and introductions. I got hooked in college, in a “Cookbooks and History” class furnished by a spectacular collection of collectibles and handwritten recipe cards; these days, the Aspen Thrift Store enables my habit and enhances it.</p> <p class=""oc-body"">You, too, can find the treasure trove at Aspen Thrift, right at the bottom of the stairs on the lower floor. It’s just about the best collection I’ve ever seen outside of a university setting (though I’ll confess I have not seen too many non-collegiate compilations), better yet because I get to keep what I find.</p> <img loading=""lazy"" width=""4032"" height=""768"" src=""https://imengine.public.prod.sci.navigacloud.com/?uuid=d1a22fc3-b64e-54ff-a827-818b938c926d&amp;type=preview&amp;width=4032&amp;height=3024&amp;q=60"" srcset=""https://imengine.public.prod.sci.navigacloud.com/?uuid=d1a22fc3-b64e-54ff-a827-818b938c926d&amp;type=preview&amp;width=300&amp;height=225&amp;q=60 300w,https://imengine.public.prod.sci.navigacloud.com/?uuid=d1a22fc3-b64e-54ff-a827-818b938c926d&amp;type=preview&amp;width=768&amp;height=576&amp;q=60 768w,https://imengine.public.prod.sci.navigacloud.com/?uuid=d1a22fc3-b64e-54ff-a827-818b938c926d&amp;type=preview&amp;width=1024&amp;height=768&amp;q=60 1024w,https://imengine.public.prod.sci.navigacloud.com/?uuid=d1a22fc3-b64e-54ff-a827-818b938c926d&amp;type=preview&amp;width=2048&amp;height=1536&amp;q=60 2048w"" alt=""""> <p class=""oc-body"">Among the treats I’ve found on those shelves: “The New York Times Cookbook” (1961) and its siblings, “The New York Times Menu Cookbook” (1966) and “The New York Times International Cookbook” (1971), all with recipes from the New York Times, and a 1971 edition of “The Playboy Host and Bar Book” and a 1979 edition “The Playboy Gourmet,” with hundreds of recipes each from Playboy magazine (yes, that Playboy).</p> <p class=""oc-body"">Tucked in the stacks, I’ve got “Beard on Bread,” a 1979 education of bread recipes by James Beard, and “Kitchen Classics from the Philharmonic,” a 1992 compilation of recipes and classical music pairings from affiliates of the New York Philharmonic.</p> <p class=""oc-body"">But my favorite acquisitions are most often the community cookbooks that contain so much of Aspen’s history in their pages. I treasure my 1988 “Snowmass Chapel Cookbook,” which features familiar names and sections like “Chapel Pastries,” “Backpack Yummies” and “Balloon Festival Breakfasts.”</p> <img loading=""lazy"" width=""4032"" height=""768"" src=""https://imengine.public.prod.sci.navigacloud.com/?uuid=059e9f56-0afa-50a1-a667-153c17b50596&amp;type=preview&amp;width=4032&amp;height=3024&amp;q=60"" srcset=""https://imengine.public.prod.sci.navigacloud.com/?uuid=059e9f56-0afa-50a1-a667-153c17b50596&amp;type=preview&amp;width=300&amp;height=225&amp;q=60 300w,https://imengine.public.prod.sci.navigacloud.com/?uuid=059e9f56-0afa-50a1-a667-153c17b50596&amp;type=preview&amp;width=768&amp;height=576&amp;q=60 768w,https://imengine.public.prod.sci.navigacloud.com/?uuid=059e9f56-0afa-50a1-a667-153c17b50596&amp;type=preview&amp;width=1024&amp;height=768&amp;q=60 1024w,https://imengine.public.prod.sci.navigacloud.com/?uuid=059e9f56-0afa-50a1-a667-153c17b50596&amp;type=preview&amp;width=2048&amp;height=1536&amp;q=60 2048w"" alt=""""> <p class=""oc-body"">A recent find, “Recipe Requests from the Mace Kitchens” from 1999, is a relic of hearty health foods from the Stuart and Isabel Mace’s family operations up at Toklat at Ashcroft and at Malachite, a farm at the base of Mt. Blanca in the Sangre de Cristo mountains.</p> <p class=""oc-body"">“<a href=""https://www.aspentimes.com/magazines/aspen-times-weekly/foodstuff-aspen-potpourri-revisited/"">Aspen Potpourri</a>,” which I scooped not at the Thrift Store but at our office, was filled with the rich flavors and faces of old Aspen.</p> <p class=""oc-body"">Most fun, though, is <a href=""https://www.aspentimes.com/news/businesswoman-socialite-tukey-koffend-dead-at-83/"">Tukey Koffend</a>’s “No Cooking at All. Almost. Hardly.” I found the book, a collection of “Interesting Recipes for the Lethargic Gourmet,” at last year’s Aspen Thrift Shop art sale. The back cover informed me that Koffend ran the “eclectic” Uriah Heep’s shop in Aspen for 25 years, hosted a daily “Aspen A.M.” show on TV with her two pugs and staked claim to the title of “oldest living cookbook author.”</p> <p class=""oc-body"">I scooped the book mostly for its quirky illustrations and its even quirkier recipes that fulfill the promise of the title — recipes like “Tomato/Orange Soup,” which calls for just two cups of orange juice and two of cream of tomato soup and claims to have a “very nice ‘mystery taste,’” and “Beets with Sour Cream,” which calls for canned beets and dollops sour cream. (Some are more elaborate, like the collections of quiches and souffles.)</p> <p class=""oc-body"">But I’m keeping it around less for the menu than for Koffend’s clever, generous voice, preserved in the book she published just a year before she died in 2005. Notorious fan of cookbooks that I am, it’s often their authors who endear me to the recipes inside.</p> <p class=""oc-body article-tagline"">Kaya Williams is a reporter for the Aspen Times and the Snowmass Sun. She doesn’t know who is taking these treasures to the Aspen Thrift Shop, but she’d like to say thanks anyway. Email her at <a href=""mailto:kwilliams@aspentimes.com"">kwilliams@aspentimes.com</a><em id=""emphasis-1ce7c505333afb8d58c1296313f26f2a"">.</em></p> ",Kaya Williams,19 May 2022,https://www.aspentimes.com/news/six-rafters-including-four-children-saved-from-roaring-fork-rivers-strong-currents/
Moore family negotiating major conservation deal for their historic ranch,"<img loading=""lazy"" width=""5926"" height=""683"" src=""https://imengine.public.prod.sci.navigacloud.com/?uuid=4e15227f-0c4e-59cb-88bf-1d5f978b74c7&amp;type=preview&amp;width=5926&amp;height=3951&amp;q=60"" srcset=""https://imengine.public.prod.sci.navigacloud.com/?uuid=4e15227f-0c4e-59cb-88bf-1d5f978b74c7&amp;type=preview&amp;width=300&amp;height=200&amp;q=60 300w,https://imengine.public.prod.sci.navigacloud.com/?uuid=4e15227f-0c4e-59cb-88bf-1d5f978b74c7&amp;type=preview&amp;width=768&amp;height=512&amp;q=60 768w,https://imengine.public.prod.sci.navigacloud.com/?uuid=4e15227f-0c4e-59cb-88bf-1d5f978b74c7&amp;type=preview&amp;width=1024&amp;height=683&amp;q=60 1024w,https://imengine.public.prod.sci.navigacloud.com/?uuid=4e15227f-0c4e-59cb-88bf-1d5f978b74c7&amp;type=preview&amp;width=2048&amp;height=1365&amp;q=60 2048w"" alt=""""> <p class=""oc-body"">When Tom Moore took stock of what’s been happening over the years to his neighborhood on McLain Flats Road, he knew he had to take action.</p> <p class=""oc-body"">“I don’t like big houses,” Moore said. “I don’t want this ranch to be wrecked.”</p> <p class=""oc-body"">Tom and his wife, Carolyn, moved as a young couple to a secluded old ranch on McLain Flats Road roughly 3 miles outside of Aspen in 1966.</p> <p class=""oc-body"">“When we moved out here, it was a lane-and-a-half dirt road,” he recalled. When two vehicles met, one had to pull over to let the other pass.</p> <p class=""oc-body"">Their friends thought they were crazy moving “so far” out of town. For them, the ranch has always remained a “godsend” for 56 years. They live in the same humble house. A majestic red barn makes the property particularly eye-catching. Plus the fact that there are usually scores of elk lounging in the pastures during cold-weather months. Tom estimated 250 head of elk were taking refuge on the ranch just north of his house during the late-season snowstorm Friday.</p> <p class=""oc-body"">“They’re all pretty good friends,” he quipped.</p> <p class=""oc-body"">But development of luxury mansions has changed the character of the area, pressing in on both sides of the ranch.</p> <p class=""oc-body"">“There’s got to be something done about it,” Moore said.</p> <p class=""oc-body"">About 18 months ago, negotiations on a conservation proposal with Pitkin County ratcheted up a notch. On Wednesday, the county commissioners will consider an ordinance to strike a deal with the Moore family to purchase a portion of their ranch outright and obtain a conservation easement on much of the remainder. The contract is for up to $10 million.</p> <p class=""oc-body"">The property is zoned for one house per 20 acres, so it could yield up to 13 lots under a development scheme. At today’s real estate prices, the Moore family could reap much more than the $10 million the county is offering.</p> <p class=""oc-body"">“They’d rather have a family legacy of conservation than squeeze every penny out of it,” said Dale Will, acquisition and special projects director for Pitkin County Open Space and Trails.</p> <p class=""oc-body"">A memo from Will to the county commissioners lays out details of the proposal. Pitkin County would obtain about 95 acres of the Moore property west of McLain Flats Road. On the east side of the road, a conservation easement would be placed on 135 acres owned in full by the Moore family. That parcel includes the iconic ranch house and barn. There is the potential to place a conservation easement on an additional 42 acres of the ranch that the Moores own with others. If those 42 acres aren’t part of the deal, the total price would be reduced to $9 million.</p> <p class=""oc-body"">The Aspen City Council will consider contributing $1 million to the purchase, according to Will’s memo.</p> <p class=""oc-body"">The Moores will receive approval for one new home on the 135 acres the family fully controls on the east side of the road. A second home site would be approved if the 42 acres they own with other parties is part of the deal. Tom and Carolyn’s farmhouse will be historically designated and preserved.</p> <p class=""oc-body"">Will said the Moore property purchase and conservation easement checks all the boxes for the open space program. It preserves agricultural lands and view planes. There is clearly wildlife benefit and an opportunity to enhance recreation.</p> <p class=""oc-body"">The 95 acres on the west side of the road lie within the Roaring Fork Gorge corridor, a 390-acre assemblage of properties already acquired by the open space program, Aspen Parks and Aspen Valley Land Trust.</p> <p class=""oc-body"">Will’s memo said the 95-acre parcel to be acquired from the Moores “contains an intact sagebrush shrubland that is increasingly rare in the upper Roaring Fork Valley and provides important habitat for migratory songbirds and other sagebrush-dependent species. This purchase will benefit both wildlife and recreationists along the (Rio Grande Trail), and allow future planning efforts to optimize both habitat effectiveness and potential soft trails consistent with that objective.”</p> <p class=""oc-body"">Of the 95 acres on the west side of the ranch, 15 acres are irrigated lands. The open space program would ensure that no structures are ever built in that “iconic viewshed” to preserve the view of Mount Daly and Sky Mountain Park to the west.</p> <p class=""oc-body"">The property east of the road provides vital elk winter range and severe winter range on west-facing slopes.</p> <p class=""oc-body"">“Anyone who travels the route between late fall and early spring cannot miss the fact that the Moore Ranch has become a sanctuary for Rocky Mountain elk, especially during their vulnerable migration and transition periods during the colder months,” Will’s memo said.</p> <p class=""oc-body"">Irrigated meadows on the ranch are leased for hay production, which Will said remains an option for the future.</p> <p class=""oc-body"">Tom and Carolyn Moore already have a lengthy track record of taking action for the good of the community. They were inducted into the <a href=""https://aspenhalloffame.org/inductee/carolyn-tom-moore/"" target=""_blank"">Aspen Hall of Fame</a><svg class=""svg-icon""><use class=""fa-external-link-alt"" xlink:href=""#fa-external-link-alt""></use></svg> in 2014 for all their endeavors and community involvement.</p> <p class=""oc-body"">In addition to numerous volunteer efforts, they also donated land for the Aspen public school campus and for the Aspen Valley Ski Club headquarters. They were the first people to work with the open space program on a land sale.</p> <p class=""oc-body"">“The first major purchase of the nascent Pitkin County Open Space Program in 1993 was Moore Open Space, which lies on the boundary into Aspen and is now one of the crown jewels of our program,” Will’s memo said.</p> <p class=""oc-body"">The Moore open space provides land for a critical part of the Nordic trail system.</p> <p class=""oc-body"">The Aspen Times detailed the Moores’ <a href=""https://www.aspentimes.com/news/giving-moore-to-aspen/"">community involvement</a> in a 2013 feature story.</p> <p class=""oc-body"">For Tom, who was born in Aspen in 1942, this latest conservation arrangement ensures that a little slice of heaven remains the same in a rapidly changing community.</p> <p class=""oc-body"">Tom and Carolyn will remain in what he called their “antique home.” It was a Sears Roebuck kit house that shipped to Woody Creek by rail and then was likely loaded onto hay wagons and moved on-site in the 1920s, Tom said. The barn  also was a kit. It’s now Tom’s wood shop and office, what he called his “man barn.”</p> <p class=""oc-body"">Be it ever so humble, there’s no place like home.</p> <p class=""oc-body""><em id=""emphasis-a81937abc4761662681ecdb627f501a7""><a href=""mailto:scondon@aspentimes.com"">scondon@aspentimes.com</a></em></p> ",Scott Condon,21 May 2022,https://www.aspentimes.com/news/six-rafters-including-four-children-saved-from-roaring-fork-rivers-strong-currents/
