Title,Text,Author,Date,Url
Teen charged with assault after striking woman with snowball from Aspen hotel roof,"<p class=""oc-body"">A 19-year-old tourist from Chicago allegedly hit a woman walking down the street in the face with a snowball from the fourth floor roof of a downtown hotel last weekend, according to a police report.</p> <p class=""oc-body"">In addition, the teen’s mother allegedly tried repeatedly to shield her son from talking to police and was also charged in the case, the report states.</p> <p class=""oc-body"">“We don’t usually write people up for a friendly snowball fight,” Aspen Assistant Police Chief Bill Linn said Thursday. “But when someone gets hit like this, it’s way over the line.”</p> <p class=""oc-body"">Drew Benson Peters was charged with misdemeanor third-degree assault and Maia Benson, 56, also of Chicago, was charged with obstructing an officer.</p> <p class=""oc-body"">“Interestingly, neither Drew or his mother asked about the well-being of the woman who had been hit with the snowball,” Aspen police Officer Roderick O’Connor wrote in his report.</p> <p class=""oc-body"">The incident began at 10:45 p.m. on March 18 after a 60-year-old Texas man and his 56-year-old wife told police they’d been walking past the W Hotel on South Spring Street after dinner when the woman was struck in the face with a snowball, according to the police report.</p> <p class=""oc-body"">When officers met with the woman, “her lower left lip was red and swollen” and “she was angry,” the report states. She declined an ambulance.</p> <p class=""oc-body"">After his wife was hit, the man told police he looked up and saw a young man four stories up on the W Hotel’s pool deck.</p> <p class=""oc-body"">“He spoke with the W Hotel security and they told him they had trouble with two 19-year-old males from earlier in the day, who were throwing snowballs from the pool area,” according to the police report, which was requested Monday by The Aspen Times and released Thursday.</p> <p class=""oc-body"">O’Connor was unable to track down Peters late Friday night, but received an email from the W Hotel’s director of security when he arrived for work Saturday evening. The security director told him that an employee of the Little Nell Hotel — next door to the W Hotel — had called at 7 a.m. March 18 and said two young men had been throwing snowballs from the W’s fourth-floor pool deck, the report states.</p> <p class=""oc-body"">W Hotel security went to the roof at that time, stopped the two 19-year-olds — who admitted throwing the snowballs — and recorded the room in which they were staying. After the Texas woman was struck in the face that night, the W’s security director found a surveillance camera image of the man suspected of throwing the snowball and was able to track him to the same room, according to the police report.</p> <p class=""oc-body"">O’Connor knocked on the room’s door about 8 p.m. Saturday but no one answered so he left his card. He returned later the same night, found the card gone, knocked again to no avail and left a second card. At that time, he learned that the occupants of the room were with the occupants of another nearby room, and he knocked on that door.</p> <p class=""oc-body"">Benson answered and tried to “negotiate” with O’Connor, who said he was going to charge her son with assault.</p> <p class=""oc-body"">“I told her there was no other option,” O’Connor wrote in the report. “I showed her the image of the male (that security) had taken. She did not recognize the male.”</p> <p class=""oc-body"">Benson said she’d speak to her son and call the officer back. However, he’d still not heard back after midnight, so he called Benson, who then told him she’d removed his cards “so her son would not worry about why the police were looking for him,” according to O’Connor’s report.</p> <p class=""oc-body"">“She told me he was probably at one of the Aspen bars,” O’Connor reported. “I asked her if he had fake identification since he was 19. She told me, ‘No, the bars in Aspen allow people under 21 to come in if they don’t drink.’ I told her that was not the case. She told me that was what her son told her and I must be mistaken.”</p> <p class=""oc-body"">O’Connor then left, but still had not heard anything by 12:50 a.m., so he returned to the hotel with an Aspen police sergeant. They knocked on Peters’ door again and received no answer, though they heard activity inside. Benson then came out into hallway and said her son wasn’t answering because he was afraid of the police, the report states.</p> <p class=""oc-body"">The officers said they weren’t going anywhere until they spoke to her son, and Benson allegedly became “very evasive,” so the officer “shifted gears,” according to the report.</p> <p class=""oc-body"">O’Connor then served Benson with a summons charging her with obstruction.</p> <p class=""oc-body"">“I told Benson if her son did not come out I would have an officer waiting for them in the morning as they left for the airport,” O’Connor wrote in the report. “I told her he would miss his flight because he would be arrested, placed in handcuffs and taken to jail.”</p> <p class=""oc-body"">Peters then came out of his room and told officers his lawyer told him not to talk to them. O’Connor, who reported that Peters matched the photo W Hotel security provided him of the alleged snowball-thrower, then served Peters with the summons for assault, which is the same as an arrest.</p> <p class=""oc-body""><em id=""emphasis-71899ab4f77fa2d1a9be08c98b2d2491""><a href=""mailto:jasulander@aspentimes.com"">jasulander@aspentimes.com</a></em></p> ",Jason Auslander,25 March 2022,https://www.aspentimes.com/news/juvenile-defendant-in-glenwood-springs-stabbing-charged-as-adult/
"Fornell cops plea over spray-paint job, doesn’t apologize to Gorsuch","<img loading=""lazy"" width=""3070"" height=""768"" src=""https://imengine.public.prod.sci.navigacloud.com/?uuid=79ad01b0-344c-5d15-bc2b-e0fb8bfe8644&amp;type=preview&amp;width=3070&amp;height=2302&amp;q=60"" srcset=""https://imengine.public.prod.sci.navigacloud.com/?uuid=79ad01b0-344c-5d15-bc2b-e0fb8bfe8644&amp;type=preview&amp;width=300&amp;height=225&amp;q=60 300w,https://imengine.public.prod.sci.navigacloud.com/?uuid=79ad01b0-344c-5d15-bc2b-e0fb8bfe8644&amp;type=preview&amp;width=768&amp;height=576&amp;q=60 768w,https://imengine.public.prod.sci.navigacloud.com/?uuid=79ad01b0-344c-5d15-bc2b-e0fb8bfe8644&amp;type=preview&amp;width=1024&amp;height=768&amp;q=60 1024w,https://imengine.public.prod.sci.navigacloud.com/?uuid=79ad01b0-344c-5d15-bc2b-e0fb8bfe8644&amp;type=preview&amp;width=2048&amp;height=1536&amp;q=60 2048w"" alt=""""> <p class=""oc-body"">With Jeff Gorsuch and his attorney seated footsteps away, Aspen resident Peter Fornell pleaded guilty Wednesday to the municipal offense of injuring public/private property, apologized to city officials and the court for spray-painting the messages “Liars Go Back to Vail” on the exterior of Gorsuch Ski Cafe, and vowed not to commit a similar offense in the future.</p> <p class=""oc-body"">Fornell accepted a plea agreement with the City Attorney’s Office requiring him to pay a $100 fine and $50 in court costs. The agreement includes a six-month deferred judgment, meaning the conviction will be removed from Fornell’s record if he isn’t cited for any criminal transgressions through the first week of October. The city has 90 days to request a restitution amount from Fornell, which he can either accept or challenge, said Assistant City Attorney Kate Johnson.</p> <p class=""oc-body"">Fornell turned himself in to Aspen police March 7, admitting to them that he spray-painted the cafe, which is located at the base of Aspen Mountain near the gondola. Based on photographs obtained by The Aspen Times and Aspen police, the <a href=""https://www.aspentimes.com/news/gorsuch-ski-cafe-windows-vandalized-late-saturday-night/"">words “Liars Go Back to Vail” were spray-painted across three windows</a> and “Liars” on another. The paint was removed the next day, which was a Sunday.</p> <p class=""oc-body"">“I’m here today to admit my actions at the Gorsuch Cafe on March 5,” Fornell read from a statement to the court Wednesday. “I acted in an irresponsible way and I regret my methods. It was ill-conceived and a poor attempt to exercise my right to free speech. Had I taken time to assess the situation, I would have taken a more healthy approach to expressing my opinion.”</p> <p class=""oc-body"">Fornell’s remarks came after Judge Brooke Peterson allowed Gorsuch to give a statement, which began when he pulled up a seat near Fornell, looked him in the face and said, “Honestly, I don’t know you well. I don’t know what could have possibly been in your mind thinking this was the right behavior.”</p> <p class=""oc-body"">Peterson then stopped Gorsuch.</p> <p class=""oc-body"">“Mr. Gorsuch, address me,” the judge said.</p> <p class=""oc-body"">Gorsuch then turned to Peterson and said Fornell’s actions went too far and harmed a family that has been part of the community for more than a half-century.</p> <p class=""oc-body"">“What happened that Sunday morning or the evening before is not acceptable behavior in the community, in the city and the community where we all strive to do a good job and take care of guests, and my guests were greeted by that violent red paint that basically called me and my family liars and said ‘leave and go away from here,’” Gorsuch said. “And you know what, we’ve been in the Aspen and the retail community for 50 years. And we’ve tried to do a lot of right things for the community and supporting the community we live and work in.</p> <p class=""oc-body"">“I find the behavior despicable and wrong and the slippery slope that it was on caused great havoc in the public and in my presence, in my business, to my people that work for me and to my family that lives here.”</p> <img loading=""lazy"" width=""4032"" height=""768"" src=""https://imengine.public.prod.sci.navigacloud.com/?uuid=b5f689b8-767f-5832-a3ec-66be75838e3a&amp;type=preview&amp;width=4032&amp;height=3024&amp;q=60"" srcset=""https://imengine.public.prod.sci.navigacloud.com/?uuid=b5f689b8-767f-5832-a3ec-66be75838e3a&amp;type=preview&amp;width=300&amp;height=225&amp;q=60 300w,https://imengine.public.prod.sci.navigacloud.com/?uuid=b5f689b8-767f-5832-a3ec-66be75838e3a&amp;type=preview&amp;width=768&amp;height=576&amp;q=60 768w,https://imengine.public.prod.sci.navigacloud.com/?uuid=b5f689b8-767f-5832-a3ec-66be75838e3a&amp;type=preview&amp;width=1024&amp;height=768&amp;q=60 1024w,https://imengine.public.prod.sci.navigacloud.com/?uuid=b5f689b8-767f-5832-a3ec-66be75838e3a&amp;type=preview&amp;width=2048&amp;height=1536&amp;q=60 2048w"" alt=""""> <p class=""oc-body"">Gorsuch’s attorney Matt Ferguson argued the case belonged in either county or district court where misdemeanor and felony cases are handled and punishments are more severe.</p> <p class=""oc-body"">“If you watched the news this morning, you’ll see what the Russian troops have been doing — putting V’s all over municipal buildings there (in Ukraine),” Ferguson said. “When people destroy windows, it means a lot in our society. These things have happened, and when you write something like ‘liars’ and ‘get out of town’ and ‘go back to Vail,’ that’s intimidation. And that’s what Jeff and Jeff Gorsuch’s family felt, that’s what his children feel. They’ve been yelled at in cars because of this incident. They’re scared. This is the wrong thing to do.”</p> <p class=""oc-body"">Fornell <a href=""//www.aspentimes.com/news/fornell-admits-gorsuch-vandalism-was-protest-against-aspen-mountain-hotel-sale/"">previously told The Aspen Times</a> he was outraged after Gorsuch and his partners flipped nearly an acre of land on Aspen Mountain <a href=""https://www.aspentimes.com/news/gorsuch-developers-sell-slice-of-aspen-mountain-for-76-25-million/"">for $76.25 million </a>after buying it for $10 million from Aspen Skiing Co. the previous July.</p> <p class=""oc-body"">The flipped land came with entitlements to build a voter-approved hotel, and was acquired by an affiliate of a Miami-based developer of luxury hotels called OKO Group, which is led by Russian-born billionaire Vladislav Doronin.</p> <p class=""oc-body"">The local team of Jim DeFrancia, Gorsuch and Bryan Peterson were the face of the 2019 campaign for an 81-room Gorsuch Haus to be built at the base of the west side of Aspen Mountain near Lift One. That March, Aspen’s electorate approved the Gorsuch Haus and associated developments by 26 votes.</p> <p class=""oc-body"">Fornell, himself a developer, also apologized to a number of people with one notable exception.</p> <p class=""oc-body"">“I want to extend my apologies to the Aspen Police Department for occupying their time,” Fornell’s statement continued. “My apologies also go to the Aspen City Attorney’s Office for having to deal with this matter. Finally, I apologize to the court. And to your honor, you have far more important matters to attend to. I regret that I have taken your valuable time and I am truly sorry. Be certain that I take this matter seriously and I intend to live up to the obligations of the plea agreement. I try to be a good citizen, and I know that my future actions will show that I’m capable of doing so.”</p> <p class=""oc-body"">Ferguson then pointed out the omission.</p> <p class=""oc-body"">“I would like to note who was not apologized to,” Ferguson said.</p> <p class=""oc-body"">Replied Judge Peterson: “I got it.”</p> <p class=""oc-body"">The Aspen Municipal Code describes the charge against Fornell — injury to public and private property prohibited — as “unlawful for any person to intentionally or knowingly to injure, deface, mutilate, remove, pull down, break or in any way interfere with or molest or secrete any trees, real or personal property belonging to or under the control of the City or any person within the City.”</p> <p class=""oc-body"">Johnson said the plea agreement with Fornell is similar to other deals the city has made for the same offense. She also noted Fornell does not have a criminal history, which factored into the outcome.</p> <p class=""oc-body"">“I appreciate the victim’s statements here, but I do have to say that I think this is a fair and just resolution to these charges,” Johnson said. “It is similar to other situations that this court has addressed on the charge of injuring private property. There have been similar situations that have happened in town. Again, this has a political flair to it but the actual act itself is similar to other acts this court has dealt with.”</p> <p class=""oc-body"">Peterson agreed the agreement was appropriate.</p> <p class=""oc-body"">“I note and recognize that Mr. Fornell, at least in my knowledge, has not apologized to the Gorsuch family and to Mr. Gorsuch, but that’s his decision and I cannot force an apology out of him,” the judge said. “That being said, I still believe the stipulation is the right way to deal with the criminal aspect of these actions, and the restitution issue remains to be seen. But for the moment and until that restitution comes back to me, the matter is closed as far as the stipulation is concerned.”</p> <p class=""oc-body"">The judge said he had to treat Fornell like any other defendant charged with the same offense, despite the high-profile nature of the vandalism.</p> <p class=""oc-body"">“I recognize that this has been hurtful to the Gorsuch family, but I’m not sure that this court can impose a higher penalty to change that,” he said.</p> <p class=""oc-body"">As a member of the Aspen Historic Preservation Commission’s board of directors, Fornell has a responsibility to behave well, Ferguson said.</p> <p class=""oc-body"">“Mr. Fornell sits on the HPC board and he’s supposed to show good judgment,” Ferguson said. “What he did was an abomination. You can’t tell people to leave town and call them liars.”</p> <p class=""oc-body"">It cost Gorsuch around $2,500 to remove the spray-paint job, which was not water based, Ferguson said. Fornell said previously he intentionally used easy-to-remove water-based red paint.</p> <p class=""oc-body"">There could be future civil action over the incident, Ferguson said.</p> <p class=""oc-body"">“The bottom line is we’ve been pressing the DA to take this up as a misdemeanor or a minor felony because he has done damage,” Ferguson said. “We don’t think it was water-based paint. It took the entire day to get that paint off and it did cost about $2,500. In addition, Mr. Gorsuch has had to retain publicists and put in numerous ads in the papers, run his letters, and try to rebut some of the damage that has been done here.”</p> <p class=""oc-body"">The Gorsuch family is known for their skiing prowess, evidenced by Jeff Gorsuch’s 2019 induction into the Colorado Ski and Snowboard Hall of Fame, joining his parents and grandfather. The family name also can be seen on ski apparel shops throughout the state. Jeff Gorsuch’s father, <a href=""https://www.aspentimes.com/news/friends-family-reflect-on-the-legacy-of-dave-gorsuch-following-his-death-at-82/"">David</a>, is considered one of Vail’s pioneers. He died in June.</p> <p class=""oc-body""><em id=""emphasis-8b9decf39b14b9735f0227e303d1d9c7""><a href=""mailto:rcarroll@aspentimes.com"">rcarroll@aspentimes.com</a></em></p> ",Rick Carroll,07 April 2022,https://www.aspentimes.com/news/juvenile-defendant-in-glenwood-springs-stabbing-charged-as-adult/
Preliminary hearing set for Glenwood Springs woman accused of double homicide,"<img loading=""lazy"" width=""300"" src=""https://imengine.public.prod.sci.navigacloud.com/?uuid=87f0b7bd-3dcb-533a-96b7-9a37455c98dd&amp;type=preview&amp;width=300&amp;height=441&amp;q=60"" srcset=""https://imengine.public.prod.sci.navigacloud.com/?uuid=87f0b7bd-3dcb-533a-96b7-9a37455c98dd&amp;type=preview&amp;width=300&amp;height=441&amp;q=60 300w,https://imengine.public.prod.sci.navigacloud.com/?uuid=87f0b7bd-3dcb-533a-96b7-9a37455c98dd&amp;type=preview&amp;width=768&amp;height=1130&amp;q=60 768w,https://imengine.public.prod.sci.navigacloud.com/?uuid=87f0b7bd-3dcb-533a-96b7-9a37455c98dd&amp;type=preview&amp;width=1024&amp;height=1507&amp;q=60 1024w,https://imengine.public.prod.sci.navigacloud.com/?uuid=87f0b7bd-3dcb-533a-96b7-9a37455c98dd&amp;type=preview&amp;width=2048&amp;height=3013&amp;q=60 2048w"" alt=""""> <p class=""oc-body"">A preliminary hearing was set Thursday for next month in the case of a Glenwood Springs woman accused of killing her children.</p> <p class=""oc-body"">Claudia Camacho-Duenas, 37, was arrested Dec. 30 after allegedly stabbing her two children on the 100 block of Soccer Field Road in Glenwood Springs.</p> <p class=""oc-body"">Her children, ages 11 and 18, were given emergency resuscitation procedures but died from their wounds after being taken to the hospital.</p> <p class=""oc-body"">Duenas was meanwhile arrested without incident and eventually charged with two counts of first-degree murder of a family member.</p> <p class=""oc-body"">Duenas is currently in jail on a $1 million bond.</p> <p class=""oc-body"">Garfield County District Court Judge Denise Lynch set Duenas’ hearing for 9 a.m. May 16.</p> <p class=""oc-body""><em id=""emphasis-1c7f6c8340f96f51be2d8db49985957a"">Reporter Ray K. Erku can be reached at 612-423-5273 or <a href=""mailto:rerku@postindependent.com"" target=""_blank"">rerku@postindependent.com</a><svg class=""svg-icon""><use class=""fa-external-link-alt"" xlink:href=""#fa-external-link-alt""></use></svg> </em></p> ",Ray Erku,08 April 2022,https://www.aspentimes.com/news/juvenile-defendant-in-glenwood-springs-stabbing-charged-as-adult/
Teen paints harrowing picture of relative’s alleged abuse in Roaring Fork Valley,"<p class=""oc-body"">A Pitkin County district judge Monday bound over a Rifle man for trial to face 168 criminal charges linked to his alleged physical, psychological and sexual abuse of a relative over a period of two years, including one incident where he purportedly tried to shove her off a cliff on Aspen Mountain.</p> <p class=""oc-body"">Defendant Frank Seme, 44, out on a $250,000 surety bond, attended in Aspen the preliminary hearing that included brief remarks from the alleged victim, who was subpoenaed to testify by public defender Scott Troxell. Also shown during the hearing was video footage of a police detective’s interview with the girl, who said she was physically and sexually abused and traumatized by her relative starting when she was 16 years old. The physical abuse began in September 2018 and the sexual abuse in February 2019, the girl told the detective.</p> <p class=""oc-body"">“If it wasn’t sexual abuse, it was physical abuse and verbal abuse,” the alleged victim told the Rifle Police Sgt. Carlos Cornejo in the interview, which was conducted Oct. 28. Nearly three hours of the interview was shown during the preliminary hearing.</p> <p class=""oc-body"">Judge Chris Seldin’s ruling allows the prosecution to carry forward 53 felony counts of sexual assault against Seme, 30 felony counts of sexual assault on a child by a person in a position of trust constituting a pattern of abuse, 83 felony counts of aggravated incest, one count of second-degree assault and one misdemeanor count of third-degree assault.</p> <p class=""oc-body"">Convictions on all charges could lead to multiple life sentences in prison for Seme. The sexual assault charges are punishable by 2 to 6 years to life in prison; the incest counts carry 4 to 12 years to life in prison; and each count of sexual assault on a child by a person in a position of trust constituting a pattern of abuse is punishable by 10 to 32 years to life in prison.</p> <p class=""oc-body"">Seldin noted his decision was largely based on the video of the girl’s interview with the Rifle police sergeant, as well as her documenting each alleged sexual encounter — including multiple instances of intercourse — on her health app’s calendar.</p> <p class=""oc-body"">“We have non-hearsay testimony to support the charge in each count,” Judge Seldin said.</p> <p class=""oc-body"">According to the alleged victim’s statement to police, she moved from her home in Nebraska to her relative’s Old Snowmass-area home in June 2018, and began her junior year at a high school in the Roaring Fork Valley that fall. In September just before her 17th birthday, Seme became mad at her and beat her with a hairbrush. He was intoxicated then and normally would drink 12 beers a day, she said.</p> <p class=""oc-body"">The sexual abuse began in the following February and became progressively worse.</p> <p class=""oc-body"">“It’s been going on since I was 17 and we lived in Snowmass,” she told Cornejo.</p> <p class=""oc-body"">The alleged victim said she couldn’t break away from her relative because she felt helpless. She also told Rifle police that before her interview with them, she spent 25 minutes outside the department before she could gather herself to tell her story.</p> <p class=""oc-body"">“I feel stupid for letting this go on that long … and I feel guilty for never fighting back,” she said.</p> <p class=""oc-body"">The girl recalled an episode in July 2019, one day before she was scheduled to take her senior pictures, when the relative took her four-wheeling up the backside of Aspen Mountain. At one point the vehicle stopped, and he wrapped a seat belt around her neck in an attempt to rape her but she was able to break free, she told Rifle police.</p> <p class=""oc-body"">“We were in the middle of nowhere,” she said. “I didn’t have a cellphone; I didn’t have anything.”</p> <p class=""oc-body"">Seme later tried to push her off a cliff but did not succeed, she said.</p> <p class=""oc-body"">“He dislocated his shoulder and screamed at me and said it was my fault,” she told police.</p> <p class=""oc-body"">The following October the two went to a show at Belly Up Aspen, and on the way back, while the girl was driving them home, Seme demanded she stop the car and have sex with him, she said. He also was drunk at the time, she told authorities.</p> <p class=""oc-body"">She resisted then and he struck her, and when they returned home she became sick before he sexually assaulted her, she said.</p> <p class=""oc-body"">“The threats and fear, what she felt, were the means and consequences that allowed [Seme] to continue the abuse,” Nottingham said during closing statements.</p> <p class=""oc-body"">After her relative kicked her out of his home in October, the victim reported the crimes to police in Rifle, where Seme was living then. Cornejo later notified Pitkin County authorities about the crimes the girl reported that occurred in Pitkin County.</p> <p class=""oc-body"">Seme is out on $250,000 surety bond after authorities arrested him in December. He is due back court in June 6 for an arraignment hearing.</p> <p class=""oc-body"">Monday’s hearing was held in a makeshift courtroom downstairs at the old Aspen City Hall building, while renovations continue at Pitkin County Courthouse on Main Street.</p> <p class=""oc-body""><em id=""emphasis-e8c6bdc5323aeb40ff804e8d82c20270""><a href=""mailto:rcarroll@aspentimes.com"">rcarroll@aspentimes.com</a></em></p> ",Rick Carroll,26 April 2022,https://www.aspentimes.com/news/juvenile-defendant-in-glenwood-springs-stabbing-charged-as-adult/
